{
  "$schema": "https://json-schema.org/draft/07/schema#",
  "$id": "https://example.com/encoder_config.schema.json",
  "title": "EncoderConfig",
  "description": "Vulkan Video Encoder configuration. JSON is loaded first (base config); command-line parameters override. Source: VkEncoderConfig (EncoderConfig), encoder_config.example.json in this directory.",
  "type": "object",
  "additionalProperties": false,
  "properties": {
    "codec": { "type": "string", "enum": ["h264", "h265", "hevc", "av1"], "description": "Video codec. hevc treated as h265." },
    "outputPath": { "type": "string", "maxLength": 255, "description": "Bitstream output file path. Empty: the command line's -o." },
    "encodeWidth": { "type": "integer", "minimum": 0, "maximum": 16384, "description": "Encode output width. 0: the input's width." },
    "encodeHeight": { "type": "integer", "minimum": 0, "maximum": 16384, "description": "Encode output height. 0: the input's height." },
    "rcMode": { "type": "string", "enum": ["cqp", "cbr", "vbr"], "description": "Rate control: cqp, cbr, vbr." },
    "averageBitrate": { "type": "integer", "minimum": 0, "description": "Target average bitrate in bits/sec." },
    "maxBitrate": { "type": "integer", "minimum": 0, "description": "Max bitrate in bits/sec (VBR)." },
    "vbvBufferSize": { "type": "integer", "minimum": 0, "description": "VBV/HRD buffer size in bits. 0 = auto." },
    "constQpI": { "type": "integer", "minimum": -1, "maximum": 51, "description": "Constant QP for I frames. -1 or 0: the driver's preferred QP." },
    "constQpP": { "type": "integer", "minimum": -1, "maximum": 51, "description": "Constant QP for P frames. -1 or 0: the driver's preferred QP." },
    "constQpB": { "type": "integer", "minimum": -1, "maximum": 51, "description": "Constant QP for B frames. -1 or 0: the driver's preferred QP." },
    "qp": { "type": "integer", "minimum": -1, "maximum": 51, "description": "Single constant QP (I/P). -1 or 0: the driver's preferred QP." },
    "minQp": { "type": "integer", "minimum": -1, "maximum": 51, "description": "Lowest QP, as --minQp. -1: no limit." },
    "maxQp": { "type": "integer", "minimum": -1, "maximum": 51, "description": "Highest QP, as --maxQp. -1: no limit." },
    "gopLength": { "type": "integer", "minimum": 0, "description": "Frames per GOP; 0 is the device's preferred length." },
    "bFrameCount": { "type": "integer", "minimum": 0, "description": "B-frames between I/P." },
    "idrPeriod": { "type": "integer", "minimum": 0, "description": "Frames between IDRs; 0 is the device's preferred period." },
    "closedGop": { "type": "boolean" },
    "frameRateNum": { "type": "integer", "minimum": 1 },
    "frameRateDen": { "type": "integer", "minimum": 1 },
    "qualityPreset": { "type": "integer", "minimum": 0, "maximum": 7 },
    "tuningMode": { "type": "string", "enum": ["default", "highquality", "lowlatency", "ultralowlatency", "lossless"], "description": "Tuning mode, as --tuningMode." },
    "colourPrimaries": { "type": "integer", "minimum": 0, "maximum": 255 },
    "transferCharacteristics": { "type": "integer", "minimum": 0, "maximum": 255 },
    "matrixCoefficients": { "type": "integer", "minimum": 0, "maximum": 255 },
    "videoFullRange": { "type": "boolean" },
    "verbose": { "type": "boolean" },
    "validate": { "type": "boolean" },
    "psnr": { "type": "boolean", "description": "PSNR input vs reconstructed (same as CLI --psnr)." },
    "crcInit": {
      "type": "array",
      "items": { "type": "integer", "minimum": 0 },
      "description": "CRC32 seed uint32s (e.g. 4294967295 and 0 for OGTEST-style); same as CLI --crcInit comma-separated list."
    }
  }
}
