{
  "codec": "h264",
  "outputPath": "",
  "encodeWidth": 0,
  "encodeHeight": 0,
  "rcMode": "cqp",
  "averageBitrate": 0,
  "maxBitrate": 0,
  "vbvBufferSize": 0,
  "constQpI": 0,
  "constQpP": 0,
  "constQpB": 0,
  "qp": -1,
  "minQp": -1,
  "maxQp": -1,
  "gopLength": 16,
  "bFrameCount": 3,
  "idrPeriod": 60,
  "closedGop": false,
  "frameRateNum": 30,
  "frameRateDen": 1,
  "qualityPreset": 0,
  "colourPrimaries": 0,
  "transferCharacteristics": 0,
  "matrixCoefficients": 0,
  "videoFullRange": false,
  "verbose": false,
  "validate": false
}
